,data.title,data.author,data.domain,data.name,data.subreddit,data.subreddit_id,data.url
0,Vintage Gaelic football match between Kerry vs Cork breaks into a scuffle and the referee has to step in.,noovek,gfycat.com,t3_cgf8wa,sports,t5_2qgzy,https://gfycat.com/insidiousspanishjellyfish
1,HMFT after I score this run...,harambevandecar,v.redd.it,t3_cgpbr9,sports,t5_2qgzy,https://v.redd.it/iajztierjyb31
2,Horton refuses to share medal podium in protest with Sun Yang at swimming world championship,Filosig,nbcsports.com,t3_cgaodv,sports,t5_2qgzy,https://www.nbcsports.com/video/mack-horton-refuses-share-podium-protest-sun-yang-worlds-400m
3,Eduardo Rodriguez gets a line drive directly into his glove,Scaulbylausis,i.imgur.com,t3_cgnweh,sports,t5_2qgzy,https://i.imgur.com/B2FbEeW.gifv
4,Manny Pacquiao knocks down Keith Thurman in the first round with a lightning right hand en route to winning a split decision for the Super WBA Welterweight World Championship,BP_Ray,gfycat.com,t3_cgempp,sports,t5_2qgzy,https://gfycat.com/eachcharminggoldfinch
5,Twins produce a triple play in first innings against the Yankees,GrantOz44,twitter.com,t3_cglpmt,sports,t5_2qgzy,https://twitter.com/MLB/status/1153460767771058179
6,Orlando Pride defender Carson Pickett meets a fan (x/post /r/mls),abesrevenge,i.redd.it,t3_cg07xv,sports,t5_2qgzy,https://i.redd.it/l1w1dvsydjb31.jpg
7,Tim Duncan joins the San Antonio Spurs staff,Redditditditdahdo,espn.com,t3_cgorbw,sports,t5_2qgzy,https://www.espn.com/nba/story/_/id/27239984/duncan-joins-spurs-staff
8,Swimmer Horton warned over podium snub to rival,nolesfan2011,bbc.com,t3_cgn8uc,sports,t5_2qgzy,https://www.bbc.com/news/world-australia-49079846?ocid=socialflow_twitter
9,"Tokyo Olympics 1-Year Out: Scandal, high costs but unrivaled demand",IvyGold,apnews.com,t3_cgbna7,sports,t5_2qgzy,https://apnews.com/80972eed8d7f4aec9ceeaebf992c38bd
10,Tampa Bay Ray’s pitcher Oliver Drake shows off his screwball,Mcgoozen,v.redd.it,t3_cfuphe,sports,t5_2qgzy,https://v.redd.it/0hcjs9ixtkb31
11,China's Zhenye Xie Shocks the World with 19.88 Asian 200m Record in London,yeaimgood,youtube.com,t3_cgdsbo,sports,t5_2qgzy,https://www.youtube.com/watch?v=tDLyjrmwMYs
12,Brooks Koepka will shame his colleagues into fixing golf’s slow play problem,Elliottafc,sbnation.com,t3_cg71uk,sports,t5_2qgzy,https://www.sbnation.com/golf/2019/7/21/20702763/brooks-koepka-slow-play-jb-holmes-british-open-2019
13,Speed Comparison: GT Cars vs. Formula 1 Cars,Hic_Forum_Est,v.redd.it,t3_cg1czm,sports,t5_2qgzy,https://v.redd.it/hf4z0bovvob31
14,5 Gold Medal in 19 Days Hima Das's interview &amp; details of all the medal and struggle she had,dhanesh_shah,v.redd.it,t3_cgb2pv,sports,t5_2qgzy,https://v.redd.it/yalivv2mrtb31
15,Irishman Shane Lowry wins British Open,Grc280,washingtonpost.com,t3_cg5fjw,sports,t5_2qgzy,https://www.washingtonpost.com/sports/2019/07/21/british-open-tee-times-pairings-leaderboard-tv-final-round/
16,Peter Sagan signs fan's book during hill climb at Tour de France,xkvicd,streamable.com,t3_cfzols,sports,t5_2qgzy,https://streamable.com/guwqf
17,ESPN reminded staff not to talk about politics after Dan Le Batard’s show Thursday,Redditditditdahdo,si.com,t3_cg3aj3,sports,t5_2qgzy,https://www.si.com/extra-mustard/2019/07/19/dan-le-batard-espn-no-politics-policy-weak-cowardly-donald-trump
18,Novak Djokovic’s epic final reveals flaws in a two-set stroll meriting an equal purse [The Guardian],Sputniki,theguardian.com,t3_cg81rc,sports,t5_2qgzy,https://www.theguardian.com/sport/2019/jul/21/novak-djokovic-men-women-equal-pay-tennis-womens-world-cup-football
19,"Adam Peaty sets a new World Record in 100m Breaststroke, first person to ever swim it under 57 seconds",ThunderbirdVII,twitter.com,t3_cg1h3h,sports,t5_2qgzy,https://twitter.com/fina1908/status/1152921516012687360
20,Netball World Cup: Silver Ferns upset Australia to capture title,dadsajoke,stuff.co.nz,t3_cg1h1i,sports,t5_2qgzy,https://www.stuff.co.nz/sport/netball/netball-world-cup/114397417/netball-world-cup-silver-ferns-upset-australia-to-capture-title
21,"At the University of Pittsburgh Library, the home plate from Forbes Field upon which the library stands is still in its original spot, and patrons can walk over and stand on it",xmxmskw,i.redd.it,t3_cfymwb,sports,t5_2qgzy,https://i.redd.it/2xjz9n9tknb31.jpg
22,Manny Pacquiao is your new WBA Super Welterweight Champion!,Reloaded9mm,twitter.com,t3_cfvgml,sports,t5_2qgzy,https://twitter.com/rapplerdotcom/status/1152805767143182336?s=20
23,Sammy wins the 2019 World Snail Racing Championship,BadNameThinkerOfer,youtu.be,t3_cg1vwt,sports,t5_2qgzy,https://youtu.be/r-6Wwd184uo
24,"Zlatan Ibrahimović just scored his second MLS career hat-trick. First goal with his right foot, second goal with his head and the third goal with his left foot!",eric1894,v.redd.it,t3_cfjau6,sports,t5_2qgzy,https://v.redd.it/5a4c8y30yeb31
25,Manny Pacquiao beats Keith Thurman on points to take WBA Super welterweight title,Sensitive_Activity,bbc.com,t3_cfxjjy,sports,t5_2qgzy,https://www.bbc.com/sport/boxing/49061554
26,Sri Lanka defeats Pakistan 5-4 to win the West Asia Baseball Cup on home turf!,Clipdodgecharge,i.redd.it,t3_cfwvn5,sports,t5_2qgzy,https://i.redd.it/4ytzmcdq7hb31.jpg
27,"23 years ago today, Muhammad Ali shocked the world by lighting the torch at the 1996 Olympics in Atlanta after getting diagnosed with Parkinson’s disease in 1984.",shrededd,i.redd.it,t3_cffdal,sports,t5_2qgzy,https://i.redd.it/0w65b94rpcb31.jpg
28,"ESPN's Max Kellerman calls Matt Stafford ""overrated""",ILOVEASIANCUNTS,espn.com,t3_cftkmk,sports,t5_2qgzy,https://www.espn.com/nfl/team/_/name/det/detroit-lions
29,Marc-André ter Stegen comes up huge with two sets of back to back saves in the same game,Mcgoozen,v.redd.it,t3_cf6j1w,sports,t5_2qgzy,https://v.redd.it/6geaqamwz8b31
30,96-Year-Old Man Runs 42-Minute 5K to Break World Record for His Age Group,ljdmd,runnersworld.com,t3_cf0xq4,sports,t5_2qgzy,https://www.runnersworld.com/news/a28421435/roy-englert-5k-age-group-world-record/
31,Mitch Petrus has died; Former Giants and Arkansas lineman dies at age 32; cause of death heat stroke,ILOVEASIANCUNTS,cbsnews.com,t3_cfet1g,sports,t5_2qgzy,https://www.cbsnews.com/news/mitch-petrus-died-new-york-giants-player-dead-age-32-cause-of-death-heat-stroke-2019-07-19/
32,Angels designate Matt Harvey and his 7.09 ERA for assignment as tough 2019 for former star continues,fightnightpicks,cbssports.com,t3_cffw2f,sports,t5_2qgzy,https://www.cbssports.com/mlb/news/angels-designate-matt-harvey-and-his-7-09-era-for-assignment-as-tough-2019-for-former-star-continues/
33,TIL Why tennis players check the ball before serving.,Pillowdebate,theguardian.com,t3_cfcnqe,sports,t5_2qgzy,https://www.theguardian.com/science/2003/jun/26/thisweekssciencequestions4
34,AFCON 2019 Final: Senegal 0 - Algeria 1,selmantabet,amp.cnn.com,t3_cfd4uh,sports,t5_2qgzy,https://amp.cnn.com/cnn/2019/07/19/football/afcon-2019-final-senegal-algeria-spt-intl/index.html
35,Keith Thurman drops Orlando Lora and taunts him on the way down.,buffalozbrown,i.imgur.com,t3_cfb2f9,sports,t5_2qgzy,https://i.imgur.com/keLaPVO.gifv
36,"ESPN host Dan Le Batard tears into Trump, as well as his own network, for 'cowardly' no-politics policy",Strictlybutters,thehill.com,t3_cf8k5d,sports,t5_2qgzy,https://thehill.com/blogs/in-the-know/in-the-know/453858-espn-host-dan-le-batard-tears-into-trump-and-his-own-network
37,Jozy Altidore scores an early goal for Toronto with a smooth back-heel flick,Mcgoozen,v.redd.it,t3_cerhsu,sports,t5_2qgzy,https://v.redd.it/kt27meifw1b31
38,"British Open: Tiger Woods, Phil Mickelson miss cut in same major",Enammul,usatoday.com,t3_cfbv3u,sports,t5_2qgzy,https://www.usatoday.com/story/sports/golf/2019/07/19/british-open-tiger-woods-phil-mickelson-will-miss-same-major-cut-for-first-time-ever/39704149/
39,Dude steals pace car at Talladega,READlbetweenl,youtu.be,t3_cfas88,sports,t5_2qgzy,https://youtu.be/ICi3kIzSIZg
40,NFL will not punish Chiefs receiver Tyreek Hill over child abuse allegations after investigation,SpiceEyes,usatoday.com,t3_cf8f0n,sports,t5_2qgzy,https://www.usatoday.com/story/sports/nfl/chiefs/2019/07/19/chiefs-tyreek-hill-nfl-no-suspension-investigation-child-abuse-allegations/1776290001/
41,Why Roy Halladay took to the skies,getthetime,si.com,t3_cfafb8,sports,t5_2qgzy,https://www.si.com/mlb/2019/07/17/roy-halladay-death-philadelphia-phillies
42,Ben Stokes nominated for New Zealander of the year,AutarchOfReddit,i.stuff.co.nz,t3_cf404a,sports,t5_2qgzy,https://i.stuff.co.nz/sport/cricket/cricket-world-cup/114356007/ben-stokes-kane-williamson-up-for-new-zealander-of-the-year
43,Paralyzed West Brook student seen moving arms in thank you video message,Kannazhaga,beaumontenterprise.com,t3_cf8947,sports,t5_2qgzy,https://www.beaumontenterprise.com/sports/hs/article/Video-Paralyzed-West-Brook-student-gives-thanks-14107916.php#photo-17855648
44,“Here is the full sequence of the Boone ejection. Hot mics galore.“,Thorntonx13,twitter.com,t3_cezf2v,sports,t5_2qgzy,https://twitter.com/jomboy_/status/1151971547147583488?s=21
45,The fastest pitstop ever: all four tires changed in 1.91 seconds! Record set by Pierre Gasly and Red Bull Racing at the British Grand Prix over the weekend.,LidoPlage,streamable.com,t3_cebyzf,sports,t5_2qgzy,https://streamable.com/3ril0
46,"In honor of Peter Crouch’s recent retirement, here’s one of his most iconic goals for Stoke City in 2012",Mcgoozen,v.redd.it,t3_cebz0t,sports,t5_2qgzy,https://v.redd.it/ms6fx389uua31
47,James Harden Joins Houston Dynamo &amp; Dash Ownership Group,JiggieSmalls,houstondynamo.com,t3_cewojl,sports,t5_2qgzy,https://www.houstondynamo.com/13
48,WNBA suspends LA Sparks’ Riquna Williams 10 games for domestic violence,chicotato,foxnews.com,t3_cepox9,sports,t5_2qgzy,https://www.foxnews.com/sports/wnba-suspends-la-sparks-riquna-williams-10-games-for-domestic-violence
49,"Pumpsie Green, 1st black player on Boston Red Sox, dies",suspect309,apnews.com,t3_ceniff,sports,t5_2qgzy,https://apnews.com/2e35db4ea62e41cca0913d94613e5ce7
50,Mohamed El Munir hustles to make the last second save for for Los Angeles FC,Mcgoozen,v.redd.it,t3_cdztfh,sports,t5_2qgzy,https://v.redd.it/j90vzlxs5pa31
51,"4 years ago today, F1 Driver Jules Bianchi died of injuries sustained at the 2014 Japanese Grand Prix",Daniel_Av0cad0,i.imgur.com,t3_ceacpm,sports,t5_2qgzy,https://i.imgur.com/iOt6jic.jpg
52,Fan jumps 30 foot gap over the Tour de France riders,Acrimonyl,youtube.com,t3_cegj5c,sports,t5_2qgzy,https://www.youtube.com/attribution_link?a=duPG-Slj8r0&amp;u=%2Fwatch%3Fv%3D8dUBQIL9uLQ%26feature%3Dshare
53,"MLB officials hope to install an international draft in 2020 or 2021, report says",fightnightpicks,cbssports.com,t3_celflm,sports,t5_2qgzy,https://www.cbssports.com/mlb/news/mlb-officials-hope-to-install-an-international-draft-in-2020-or-2021-report-says/
54,"Newcastle United’s passionate Chinese fan base make their feelings clear about the English club’s owner inside the Nanjing Olympic Stadium and hold up ""Ashley Out"" posters",AnitaApplebum8,i.imgur.com,t3_cebujv,sports,t5_2qgzy,https://i.imgur.com/Tvxt88z.jpg
55,LA Sparks guard Riquna Williams suspended 10 games for domestic violence incident | Sport,kmas_2006,theguardian.com,t3_cedi0d,sports,t5_2qgzy,https://www.theguardian.com/sport/2019/jul/16/riquna-williams-wnba-suspension-domestic-violence
56,Betty Heidler’s incredible hammer throw,BritDSTattoos,gfycat.com,t3_cdqex8,sports,t5_2qgzy,https://gfycat.com/completepaleargali
57,The Audience Winces as Alexander Megos (GER) Does a Side Split Drop Knee at the 2019 Lead World Cup in Chamonix.,BowlPotato,v.redd.it,t3_cdxslt,sports,t5_2qgzy,https://v.redd.it/qdraslxxona31
58,Ben Simmons becomes Australia's richest athlete with huge 76ers deal,Elliottafc,theguardian.com,t3_ce1tof,sports,t5_2qgzy,https://www.theguardian.com/sport/2019/jul/16/ben-simmons-becomes-australias-richest-athlete-with-huge-76ers-deal
59,Riyad Mahrez sends Algeria in the final of AFCON with a Free Kick at the very last second of the game.,The_Algerian,streamable.com,t3_cdgkt0,sports,t5_2qgzy,https://streamable.com/24qgv
60,VIDEOS : Celebrating One-Year Of Cristiano Ronaldo at Juventus,nitesh07ozil,juventusera.com,t3_ce09gi,sports,t5_2qgzy,https://juventusera.com/video-celebrating-one-year-of-cristiano-ronaldo-at-juventus/
61,Fans in Trafalgar Square at the end of the World Cup final,ElbethRidge,streamable.com,t3_cdf2um,sports,t5_2qgzy,https://streamable.com/3k9kc
62,England win the ICC cricket World Cup 2019 after a super-over,DavidRobertsReddit,i.redd.it,t3_cd6dlq,sports,t5_2qgzy,https://i.redd.it/187mm0uhbba31.jpg
63,"Former champion boxer Pernell 'Sweet Pea' Whitaker hit, killed crossing Virginia Beach street",Damasticator,13newsnow.com,t3_cdhlx3,sports,t5_2qgzy,https://www.13newsnow.com/article/news/local/mycity/virginia-beach/retired-champion-boxer-pernell-sweet-pea-whitaker-hit-killed-crossing-virginia-beach-street/291-128fc419-9612-4b71-84fe-5de86893f91a
64,[Rugby League] Zak Hardaker shows off his football skills against Saints,ArkLife1,streamable.com,t3_cdinpx,sports,t5_2qgzy,https://streamable.com/3jbfq
65,Novak Djokovic defeats Roger Federer to win 5th Wimbledon title,snahtanoj,theguardian.com,t3_cd64fz,sports,t5_2qgzy,https://www.theguardian.com/sport/live/2019/jul/14/novak-djokovic-v-roger-federer-wimbledon-mens-singles-final-live
66,Ashima Shiraishi (USA) Crushes the Hollywood Campus Move at the 2019 Lead World Cup in Chamonix,BowlPotato,v.redd.it,t3_cdlcd7,sports,t5_2qgzy,https://v.redd.it/8lmkw9lu4ha31
67,Elia Viviani's disbelieving look after loosing by a hair to Wout van Aert,HungryMalloc,i.redd.it,t3_cdj2m8,sports,t5_2qgzy,https://i.redd.it/f09jf7qmmha31.gif
68,"England become the first country in the world to complete the world cup triple crown in winning the Fifa World Cup (1966), Rugby World Cup (2003), and today the ICC Cricket World Cup",youtossershad1job2do,bbc.com,t3_cd6fmg,sports,t5_2qgzy,https://www.bbc.com/sport/cricket/48983890
69,Agustín Marchesín saves 3 PKs before scoring the winner for Club Ameríca in the 2019 Campeón de Campeones Final,blachat,gfycat.com,t3_cdd3os,sports,t5_2qgzy,https://gfycat.com/determinedunderstatedindianrockpython
70,Legendary boxer Pernell 'Sweet Pea' Whitaker dies after he's hit by a vehicle,johnson1124,cnn.com,t3_cdise5,sports,t5_2qgzy,https://www.cnn.com/2019/07/15/us/boxer-pernell-sweet-pea-whitaker-death-trnd/index.html
71,Red Bull Racing sets a new world record with a 1.9 second pit stop,caindaddy,v.redd.it,t3_cdanzi,sports,t5_2qgzy,https://v.redd.it/g8gaibs16da31
72,Spanish soccer team prints racist slurs on jerseys to fight discrimination,crispy_attic,elpais.com,t3_cdjbwd,sports,t5_2qgzy,https://elpais.com/elpais/2019/05/28/inenglish/1559045898_637192.html
73,"Novak Djokavic has won the 2019 Wimbledon, in the longest match in gentlemen’s single ever - Over 5 hours",frederferf,i.redd.it,t3_cd64n7,sports,t5_2qgzy,https://i.redd.it/4u5tr1dp7ba31.jpg
74,CWC19 Final: NZ v ENG – Match highlights,hexerus,cricketworldcup.com,t3_cda095,sports,t5_2qgzy,https://www.cricketworldcup.com/video/1279178
75,Novak Djokovic teams up with Hollywood stars in “The Gamechangers”,lnfinity,tennisworldusa.org,t3_cdgatl,sports,t5_2qgzy,https://www.tennisworldusa.org/tennis/news/Novak_Djokovic/73077/novak-djokovic-teams-up-with-hollywood-stars-in-the-gamechangers/
76,Swedish man dismayed after being told he cannot change name to Tottenham,sslloooww,theguardian.com,t3_cdi03u,sports,t5_2qgzy,https://www.theguardian.com/football/2019/jul/15/man-sweden-change-name-tottenham-denied-disappointed
77,"Red Bull just made the fastest pit stop in F1 history, 1.90 seconds",TeamMystic124,gfycat.com,t3_cdbalh,sports,t5_2qgzy,https://gfycat.com/genuineignorantiaerismetalmark
78,Tyler Lussi scores game winner for Portland Thorns FC in last minute of stoppage time in the first ESPN-hosted NWSL game of the season,Bologna_Warrior,espn.com,t3_cdcgng,sports,t5_2qgzy,http://www.espn.com/espnw/video/27191002/portland-score-winner-deep-stoppage-time
79,Tim Southee's wonderful low catch to dismiss Jos Buttler in the Cricket World Cup final,shanmukh1608,cricketworldcup.com,t3_cd5vfa,sports,t5_2qgzy,https://www.cricketworldcup.com/video/1279032
80,'Beat the Freeze' race gives fan a generous head start,ariverra,i.redd.it,t3_ccu48c,sports,t5_2qgzy,https://i.redd.it/fm4v0ysaryb21.gif
81,"Sepp Haidacher (1949-2019), coach of the 1988 Jamaican bobsled team",NaBUru38,ibsf.org,t3_cd4j27,sports,t5_2qgzy,https://www.ibsf.org/en/news/8-bobsleigh/21242-ibsf-mourns-former-bobsleigh-coach-sepp-haidacher
82,"Congratulations to Portugal, Roller Hockey World Champions! (Penalties, Portugal 2 - 1 Argentina)",Hotwire-a-Uterus,publico.pt,t3_cd682i,sports,t5_2qgzy,https://www.publico.pt/2019/07/14/desporto/noticia/portugal-sagrase-campeao-mundial-hoquei-patins-1879872
83,Rip kawhis nightlife in toronto,CanadianMeiHam,i.redd.it,t3_cdayi0,sports,t5_2qgzy,https://i.redd.it/nd3c6g8dbda31.png
84,Cyclist impaled by a piece of wooden track.,captn_awkward,mirror.co.uk,t3_cd5tvj,sports,t5_2qgzy,https://www.mirror.co.uk/sport/other-sports/cycling/cyclist-lorenzo-gobbo-intensive-care-18206965
85,Hima Das wins third gold in less than two weeks,thisappear,timesofindia.indiatimes.com,t3_cd185t,sports,t5_2qgzy,https://timesofindia.indiatimes.com/sports/more-sports/athletics/hima-das-wins-third-gold-in-less-than-two-weeks/articleshow/70209607.cms
86,MLB: Angels throw no-hitter on night to honour Skaggs,CrackerGuy,espn.com,t3_ccn2me,sports,t5_2qgzy,https://www.espn.com/mlb/story/_/id/27178907/angels-throw-no-hitter-night-honor-skaggs
87,Simona Halep Upsets Serena Williams to Win First Wimbledon Title,nolesfan2011,lastwordontennis.com,t3_ccppcm,sports,t5_2qgzy,https://lastwordontennis.com/2019/07/13/simona-halep-upsets-serena-williams-to-win-first-wimbledon-title/
88,Hungary wins 64-0 against South Korea at the FINA World Championship,HungarianDude,koreaherald.com,t3_cd081q,sports,t5_2qgzy,http://koreaherald.com/view.php?ud=20190714000147#cb
89,Italian rider impaled by huge splinter at European Junior Track Championships,BabySamurai,cyclingnews.com,t3_cd2ajy,sports,t5_2qgzy,http://www.cyclingnews.com/news/italian-rider-impaled-by-huge-splinter-at-european-junior-track-championships/
90,"Roger Federer Defeats Rafael Nadal to Reach Wimbledon Final, where he will Face Novak Djokovic",yesh222,lastwordontennis.com,t3_cceub9,sports,t5_2qgzy,https://lastwordontennis.com/roger-federer-defeats-rafael-nadal-wimbledon-final-novak-djokovic
91,"In the span of 105 days UFC fighter Johnny Walker becomes a ranked prospect in the LHW division, earns three performance of the night bonuses and injures himself celebrating.",footballvideos2019,streamable.com,t3_cctq92,sports,t5_2qgzy,https://streamable.com/fskj2
92,Grayson Allen called for two Flagrant 1 fouls and ejected from the game during the ongoing NBA Summer League,SkoivanSchiem,youtu.be,t3_cclx91,sports,t5_2qgzy,https://youtu.be/miyHUtrIFCg?t=40
93,Lawyers - Elliott 'target of extortion' in complaint,ILOVEASIANCUNTS,espn.com,t3_ccxfs9,sports,t5_2qgzy,https://www.espn.com/nfl/story/_/id/27183626/lawyers-elliott-target-extortion-complaint
94,Mike Trout pays tribute to Tyler Skaggs with a 454 foot home run,Debater3301,bdata-producedclips.mlb.com,t3_cckk0v,sports,t5_2qgzy,https://bdata-producedclips.mlb.com/069953eb-5f76-4c58-a34a-1280ec246a18.mp4
95,Josh Norman jumping over a bull in Pamplona,Sam_Porter,v.redd.it,t3_cc3s85,sports,t5_2qgzy,https://v.redd.it/g6rkbvn4qr931
96,Schalke 04 puts up 20 goals in club friendly against VfB Bottrop,sraffetto6,youtu.be,t3_ccl9xj,sports,t5_2qgzy,https://youtu.be/Uqv9axiSK9E
97,"FC Barcelona has signed star forward Antoine Griezmann from Atletico Madrid for €120 million, controversy ensues",taithau,i.redd.it,t3_ccc2m0,sports,t5_2qgzy,https://i.redd.it/upyohetu1w931.jpg
98,Sifan Hassan Breaks Women's Mile Record with 4:12.33 at Monaco Diamond League,Ketelbink,youtube.com,t3_cchpz9,sports,t5_2qgzy,https://www.youtube.com/watch?v=YNc1l8ESC2g
99,"Cricket World Cup final, Wimbledon men's final, British GP, Netball World Cup... What sport to watch this Sunday?",NaBUru38,bbc.com,t3_ccc533,sports,t5_2qgzy,https://www.bbc.com/sport/48961205
100,"Diamond League 400m - False start, but three runners don't hear the 2nd gun, keeps running",tjamen,youtube.com,t3_ccg5y7,sports,t5_2qgzy,https://www.youtube.com/watch?v=FMRGDwhulxc
101,England knock out the defending champions and power into their first World Cup final since 1992.,drsleep007,twitter.com,t3_cbxlwi,sports,t5_2qgzy,https://twitter.com/ESPNcricinfo/status/1149351190557163521?s=09
102,The most insane cornhole shot I've ever seen,-_Illusion-_,v.redd.it,t3_cbnn49,sports,t5_2qgzy,https://v.redd.it/bjlru3fizj931
103,Thunder trade Russell Westbrook to the Houston Rockets for Chris Paul and picks,sugashane707,twitter.com,t3_cc3qqr,sports,t5_2qgzy,https://twitter.com/wojespn/status/1149474995996749825?s=09
104,Australia vs. England: England ends 27-year wait to reach World Cup final,jq1984_is_me,edition.cnn.com,t3_cbxrry,sports,t5_2qgzy,https://edition.cnn.com/2019/07/11/sport/australia-england-wc-cricket-spt-intl/index.html
105,Throwback to the 2011 WWC- USA vs Brazil - Wambach tying goal in 123rd Minute,RabidSquabbit,youtube.com,t3_cc3xrw,sports,t5_2qgzy,https://www.youtube.com/watch?v=mMny4Nml0Ds
106,Cricket World Cup: England's final against New Zealand live on free-to-air TV,UnescoCertified,bbc.com,t3_cbzhnp,sports,t5_2qgzy,https://www.bbc.com/sport/cricket/48957255
107,"Supercars driver and his pit crew caught up in a fire caused by a petrol leak during a pitstop, mid-race",Shaynaenae,youtu.be,t3_cbwvto,sports,t5_2qgzy,https://youtu.be/Apf_cW-WTf0
108,Dangerous bouncer from Archer knocks out Carey's helmet and leaves him bleeding,idc56,imgur.com,t3_cbybpl,sports,t5_2qgzy,https://imgur.com/SQgSJBn
109,FIFA doubling racism punishment to 10 games,crispy_attic,espn.com,t3_cbx6m6,sports,t5_2qgzy,https://www.espn.com/soccer/story/3898468/fifa-doubling-racism-punishment-to-10-games?platform=amp
110,U.S. Women's Soccer Team Accused Of Snubbing Star Player For Christian Views,Madstork1981,dailywire.com,t3_cbxomw,sports,t5_2qgzy,https://www.dailywire.com/news/49375/us-womens-soccer-team-accused-snubbing-star-player-hank-berrien?utm_source=facebook&amp;utm_medium=social&amp;utm_campaign=benshapiro
111,Stunning 1 handed catch from Jimmy Neesham,ScarletLion1,self.sports,t3_cbf8xa,sports,t5_2qgzy,https://www.reddit.com/r/sports/comments/cbf8xa/stunning_1_handed_catch_from_jimmy_neesham/
112,'Robot umpires' debut in Atlantic League ASG,Doc_Dante,espn.com,t3_cbv3hf,sports,t5_2qgzy,https://www.espn.com/mlb/story/_/id/27164197/robot-umpires-debut-atlantic-league-asg
113,Martin Guptill's perfect throw to run out M.S. Dhoni at the close of the World Cup Semifinal,LAsportsnpoliticsguy,self.sports,t3_cbh76s,sports,t5_2qgzy,https://www.reddit.com/r/sports/comments/cbh76s/martin_guptills_perfect_throw_to_run_out_ms_dhoni/
114,Jadeja sword celebration to taunt media who said he couldn't play well.,shadowknight094,self.sports,t3_cbqhtl,sports,t5_2qgzy,https://www.reddit.com/r/sports/comments/cbqhtl/jadeja_sword_celebration_to_taunt_media_who_said/
115,"When Adam Thielen was a rookie, a friend and former teammate (from Minnesota State, Mankato) made a bet with him that if Adam ever made the Pro Bowl, he would get a tattoo of Adam's face. Adam Thielen made the Pro Bowl last year. Yesterday his friend made good on the bet with this beaut!",JJenkinsIII,i.redd.it,t3_cbq9zt,sports,t5_2qgzy,https://i.redd.it/h59r1s251k931.png
116,Angels Slugger Mike Trout Wearing His Late Teammate Tyler Skaggs' Number 45 for the All Star Game,Meatprint,i.imgur.com,t3_cb9jvd,sports,t5_2qgzy,https://i.imgur.com/hSANdDS.jpg
117,New Zealand beat India by 18 runs in The First Semifinals of ICC Cricket World Cup 2019,shantanu011,espncricinfo.com,t3_cbh1pp,sports,t5_2qgzy,https://www.espncricinfo.com/series/8039/game/1144528/india-vs-new-zealand-1st-semi-final-icc-cricket-world-cup-2019
118,James Tedesco scores in the final minute of the State of Origin decider to win the series 2-1 for the New South Wales Blues,baimastr1,streamable.com,t3_cbgant,sports,t5_2qgzy,https://streamable.com/bgc9r
119,"11 years later, Federer-Nadal to meet at Wimbledon again",nolesfan2011,si.com,t3_cbkyhl,sports,t5_2qgzy,https://www.si.com/tennis/2019/07/10/roger-federer-rafael-nadal-wimbledon-semifinals-preview
120,Mike Trout: The brilliant $426.5m MLB star most Americans don't know,jakey_bear,bbc.com,t3_cbh1jz,sports,t5_2qgzy,https://www.bbc.com/sport/baseball/48894773
121,19 year old Formula 2 racing driver Dino Zamparelli shows his lightning reactions to an almost certain crash in the wet at Belgium,ariverra,gfycat.com,t3_caw5w5,sports,t5_2qgzy,https://gfycat.com/daringforthrightgoose
122,Blue Jays Vladimir Guerrero Jr sets an MLB Home Run Derby record with 29 Home Runs in a single round,SeattleMana,i.imgur.com,t3_catk55,sports,t5_2qgzy,https://i.imgur.com/YtEbqTt.jpg
123,Alexander Megos (GER) Finds the No-Hands Rest on Route to a Top at the 2019 Lead World Cup in Villars.,BowlPotato,v.redd.it,t3_cakklk,sports,t5_2qgzy,https://v.redd.it/qjs1ev55s2931
124,Analysis | Are U.S. women’s soccer players really earning less than men?,pricklyPaper,washingtonpost.com,t3_cb17ti,sports,t5_2qgzy,https://www.washingtonpost.com/politics/2019/07/08/are-us-womens-soccer-players-really-earning-less-than-men/?noredirect=on&amp;utm_term=.4a8c785945fc
125,I made this design to show support for the US Women. Hope you all enjoy!,jakevanyahres,i.redd.it,t3_cao4v9,sports,t5_2qgzy,https://i.redd.it/o4s4ht8684931.png
126,What are these on the back of Joc Pederson's neck?,mungoflago,i.redd.it,t3_caug3l,sports,t5_2qgzy,https://i.redd.it/w15ivfm2r6931.jpg
