,data.title,data.author,data.domain,data.name,data.subreddit,data.subreddit_id,data.url
1005,Trump claims he didn't have 'talking points' to degrade Rep. Ilhan Omar. Here's a picture of him holding them.,TheWeekMag,theweek.com,t3_cgdemd,politics,t5_2cneq,https://theweek.com/speedreads/854119/trump-claims-didnt-have-talking-points-degrade-rep-ilhan-omar-heres-picture-holding
1006,"Mueller to Draw Broadcast Crowd: NBC, Fox to make extensive live coverage available to stations",SOYLENT_IS_PEOPLE,broadcastingcable.com,t3_cge4nz,politics,t5_2cneq,https://www.broadcastingcable.com/news/mueller-to-draw-broadcast-crowd
1007,House Should Prepare Criminal Referral of A.G. Barr for Lying to Congress,randalflagg,justsecurity.org,t3_cgd72i,politics,t5_2cneq,https://www.justsecurity.org/64972/house-should-prepare-criminal-referral-of-a-g-barr-for-lying-to-congress/
1008,Giuliani warns Epstein case could 'implicate a lot of people',lurkity_mclurkington,thehill.com,t3_cgixkd,politics,t5_2cneq,https://thehill.com/hilltv/rising/454141-rudy-giuliani-warns-epstein-case-could-implicate-a-lot-of-people
1009,"Officer suggests Ocasio-Cortez should be shot, after he read fake news on Facebook",steveben1990,washingtonpost.com,t3_cgdqra,politics,t5_2cneq,https://www.washingtonpost.com/politics/2019/07/22/officer-suggests-ocasio-cortez-should-be-shot-after-he-read-fake-news-facebook/?tid=sm_tw&amp;noredirect=on
1010,Trump says Mueller should not be allowed to tell congress about his obstruction: 'It will be bad for him',OutThinkz,independent.co.uk,t3_cgd3xa,politics,t5_2cneq,https://www.independent.co.uk/news/world/americas/us-politics/trump-mueller-hearing-russia-collusion-twitter-us-president-democrats-congress-a9015651.html
1011,"Shared Live On Facebook, Immigration Agents In Kansas City Smash Car Window To Arrest Man",miguisystem,kcur.org,t3_cgleur,politics,t5_2cneq,https://www.kcur.org/post/shared-live-facebook-immigration-agents-kansas-city-smash-car-window-arrest-man
1012,"By Republican Standards, Almost Nothing Is Racist",brithus,theatlantic.com,t3_cglytg,politics,t5_2cneq,https://www.theatlantic.com/ideas/archive/2019/07/republicans-standards-nothing-racist/594223/?utm_source=twitter&amp;utm_medium=social&amp;utm_campaign=share
1013,"Sorry, Al Franken: 7 senators regret pushing Franken to resign, as new reporting casts doubt on key allegation",Gambit08,yahoo.com,t3_cgez4d,politics,t5_2cneq,https://www.yahoo.com/news/al-franken-senate-resignation-regrets-jane-mayer-140923542.html
1014,"If it walks like a hate group and talks like a hate group, then the Republican Party must be . . . | Opinion",Electronic_Lynx,miamiherald.com,t3_cgnukc,politics,t5_2cneq,https://www.miamiherald.com/opinion/opn-columns-blogs/leonard-pitts-jr/article232893067.html
1015,'Our paychecks bounced': US workers in limbo as coalmines suddenly close,throwforthefences,theguardian.com,t3_cge3o7,politics,t5_2cneq,https://www.theguardian.com/business/2019/jul/22/blackjewel-mines-shut-down-layoffs-future
1016,Ukrainian officials and Giuliani are sharing back-channel campaign information: report,noscreamattheend,thehill.com,t3_cgek1g,politics,t5_2cneq,https://thehill.com/homenews/campaign/454133-ukrainian-officials-and-giuliani-are-sharing-back-channel-campaign
1017,Mueller will make the full report his official statement to Congress committees.,TheArtOfXenophobia,nbcnews.com,t3_cgipn0,politics,t5_2cneq,https://www.nbcnews.com/news/amp/ncna1032531
1018,Federal Officials Are Illegally Campaigning for Trump at Work,memoriesofcold,truthout.org,t3_cgc9nd,politics,t5_2cneq,https://truthout.org/articles/federal-officials-are-illegally-campaigning-for-trump-at-work/
1019,Federal government found 'go back to your country' phrase to be considered discriminatory in cases,fathers785,edition.cnn.com,t3_cgcmhd,politics,t5_2cneq,https://edition.cnn.com/2019/07/20/politics/go-back-to-your-country-eeoc-cases-find-discriminatory/index.html?utm_term=image&amp;utm_content=2019-07-22T12%3A28%3A03&amp;utm_medium=social&amp;utm_source=twCNNp
1020,"As Ilhan Omar Said, Trump Is a Fascist — and His Rallies Prove It",memoriesofcold,truthout.org,t3_cghfta,politics,t5_2cneq,https://truthout.org/articles/as-ilhan-omar-said-trump-is-a-fascist-and-his-rallies-prove-it/
1021,Senators Release Investigative Report Revealing New Ethics Lapses and Detailing the Far-Reaching Influence of Industry Law Firm Groups at EPA's Air Office,besselfunctions,epw.senate.gov,t3_cglp2v,politics,t5_2cneq,https://www.epw.senate.gov/public/index.cfm/2019/7/senators-release-investigative-report-revealing-new-ethics-lapses-and-detailing-the-far-reaching-influence-of-industry-law-firm-groups-at-epa-s-air-office
1022,Secret Files Revealed in North Carolina Gerrymandering Case,Special_Agent_Foles,courthousenews.com,t3_cgejjy,politics,t5_2cneq,https://www.courthousenews.com/secret-files-revealed-in-north-carolina-gerrymandering-case/
1023,People privy to the intelligence are convinced another electoral attack is coming,The-Autarkh,washingtonpost.com,t3_cgihu8,politics,t5_2cneq,https://www.washingtonpost.com/opinions/2019/07/22/people-privy-intelligence-are-convinced-another-electoral-attack-is-coming/
1024,Beto Compares Trump Crowds Chanting ‘Send Her Back’ To Nazi Rallies At Nuremberg,gamedemon24,forward.com,t3_cglp29,politics,t5_2cneq,https://forward.com/fast-forward/428111/beto-trump-send-her-back-nuremberg-aoc/
1025,Trump talked about Mueller’s testimony for around 90 seconds. He packed in 6 lies.,elguiridelocho,vox.com,t3_cgj1xl,politics,t5_2cneq,https://www.vox.com/2019/7/22/20704273/trump-mueller-testimony-watch-a-little-bit-lies
1026,"Commerce Secretary Wilbur Ross ""Can’t Stop Falling Asleep in Meetings"" says report",thewateroflife,thedailybeast.com,t3_cgbki5,politics,t5_2cneq,https://www.thedailybeast.com/wilbur-ross-cant-stop-falling-asleep-in-meetings-at-commerce-department-says-report
1027,Warren warns of ‘coming economic crash’,alt213,politico.com,t3_cgceeh,politics,t5_2cneq,https://www.politico.com/story/2019/07/22/elizabeth-warren-economic-crash-1424588
1028,The Latest Republican Dog Whistle: ‘They Hate America’,Davisinat,washingtonmonthly.com,t3_cggr70,politics,t5_2cneq,https://washingtonmonthly.com/2019/07/22/the-latest-republican-dog-whistle-they-hate-america/
1029,"Donald Trump reportedly considering hosting G7 Summit at his own golf resort blasted as ""extremely problematic""",DanishPastry789,newsweek.com,t3_cgid2h,politics,t5_2cneq,https://www.newsweek.com/extremely-problematic-trump-considers-using-own-resort-host-g7-summit-1450564
1030,Justin Bieber calls out Trump for helping A$AP Rocky but not letting 'kids out of cages',Barryuuat,ktvu.com,t3_cgeutn,politics,t5_2cneq,http://www.ktvu.com/news/justin-bieber-calls-out-trump-for-helping-a-ap-rocky-but-not-letting-kids-out-of-cages-
1031,DOJ tells Robert Mueller: 'any testimony must remain in the boundaries of your public report',OwnRules,cnn.com,t3_cgkmkw,politics,t5_2cneq,https://www.cnn.com/2019/07/22/politics/doj-has-not-seen-robert-mueller-opening-statement/index.html?utm_medium=social&amp;utm_content=2019-07-22T23%3A14%3A03&amp;utm_source=twCNNp&amp;utm_term=image
1032,"He Was Told to Go Back to Africa. Instead, He May Go to the U.S. Senate.",koavf,theintercept.com,t3_cgl7jn,politics,t5_2cneq,https://theintercept.com/2019/07/22/wilmot-collins-senate-montana/
1033,South Korea says it has fired warning shots after Russian military planes intruded into South Korea's airspace,racist_in_chief_,abcnews.go.com,t3_cgmp04,politics,t5_2cneq,https://abcnews.go.com/International/wireStory/south-korea-fired-warning-shots-russian-military-planes-64499273
1034,"Hindu Priest Brutally Attacked Outside Temple, Faith Groups Blame Trump's Attack on Immigrants: 'This Results in Real Harm Inflicted on Our Communities'",Trump_Wears_Diapers,newsweek.com,t3_cgcjqz,politics,t5_2cneq,https://www.newsweek.com/hindu-priest-attck-new-york-trump-1450462
1035,Republican 2020 convention host city Charlotte condemns Trump’s ‘racist and xenophobic’ comments,corginamedzelda,washingtonpost.com,t3_cgn73q,politics,t5_2cneq,https://www.washingtonpost.com/politics/republican-2020-convention-host-city-charlotte-condemns-trumps-racist-and-xenophobic-comments/2019/07/22/683a28d4-accd-11e9-8e77-03b30bc29f64_story.html?utm_term=.18bd310b2e06
1036,Louisiana police officer fired after saying on Facebook that Ocasio-Cortez 'needs a round',racist_in_chief_,thehill.com,t3_cgk8f5,politics,t5_2cneq,https://thehill.com/homenews/house/454210-louisiana-police-officer-fired-after-saying-ocasio-cortez-needs-a-round-on
1037,"Democrats want Robert Mueller's blockbuster congressional testimony to make the public aware of what's in his report, which most people still haven't read",Bubble_Toil_Trouble,businessinsider.com,t3_cggtoo,politics,t5_2cneq,https://www.businessinsider.com/democrats-want-exposure-special-counsel-robert-mueller-report-hearing-2019-7
1038,Trump has not built single mile of new border wall since taking office,cogit4se,independent.co.uk,t3_cgbgcp,politics,t5_2cneq,https://www.independent.co.uk/news/world/americas/us-politics/donald-trump-border-wall-not-built-2020-campaign-a9015181.html
1039,This Dem Slow-Walked Getting Trump’s Taxes—Now He’s Getting Primaried,wonderingsocrates,thedailybeast.com,t3_cgbqb5,politics,t5_2cneq,https://www.thedailybeast.com/richard-neal-slow-walked-getting-trumps-taxesnow-hes-getting-primaried?source=articles&amp;via=rss
1040,Deficit Don? Red ink gushes in Trump era,StupendousMan1995,politico.com,t3_cgm3lt,politics,t5_2cneq,https://www.politico.com/story/2019/07/22/deficit-don-budget-red-ink-trump-1426696
1041,Two Police Officers Are Fired Over Facebook Post Saying Ocasio-Cortez ‘Needs a Round’,CuentasSonInutiles,nytimes.com,t3_cgmujj,politics,t5_2cneq,https://www.nytimes.com/2019/07/22/us/gretna-police-charlie-rispoli-aoc.html
1042,"Mueller, drop the Yoda act",segvcore,cnn.com,t3_cgfc8y,politics,t5_2cneq,https://www.cnn.com/2019/07/22/opinions/congress-robert-mueller-questions-honig/index.html
1043,Nearly Three-Quarters of White Evangelicals Approve of Donald Trump,FetcherLeVache,newsweek.com,t3_cgmf8q,politics,t5_2cneq,https://www.newsweek.com/nearly-three-quarters-white-evangelicals-approve-donald-trump-1450610
1044,Here’s the Pete Buttigieg Interview a Country Radio Station Doesn’t Want You to Hear,spleendamage,news.vice.com,t3_cglg3h,politics,t5_2cneq,https://news.vice.com/en_us/article/43jjv3/heres-the-pete-buttigieg-interview-a-country-radio-station-doesnt-want-you-to-hear
1045,Trump Seems Worked Up Over Mueller Testimony He Says He Won’t Watch,dick_fannin,talkingpointsmemo.com,t3_cge93j,politics,t5_2cneq,https://talkingpointsmemo.com/news/trump-mueller-testimony-tweet
1046,Justice Department Warns Mueller Not to Tell Congress Too Much,roku44,thedailybeast.com,t3_cgniz5,politics,t5_2cneq,https://www.thedailybeast.com/justice-department-warns-robert-mueller-not-to-tell-congress-too-much
1047,Elizabeth Warren Is Warning of a Recession. Maybe We Should Listen.,alt213,slate.com,t3_cglx0g,politics,t5_2cneq,https://slate.com/news-and-politics/2019/07/elizabeth-warren-warns-recession-economic-predicts-crisis-right-before.html
1048,Alleged Mob Boss Killer Is QAnon Believer Who Thought Trump Backed Him,spaceghoti,talkingpointsmemo.com,t3_cgjzbp,politics,t5_2cneq,https://talkingpointsmemo.com/news/anthony-comello-frank-cali-qanon-conspiracy-mob-killer-lawyer-says
1049,"“We’re not ready” for foreign election interference in 2020, says Rep. Adam Schiff",mvea,vox.com,t3_cgchye,politics,t5_2cneq,https://www.vox.com/recode/2019/7/22/20702196/adam-schiff-deepfakes-nancy-pelosi-google-twitter-facebook-2020-youtube-kara-swisher-decode-podcast
1050,The Case of Al Franken - A close look at the accusations against the former Senator,swingadmin,newyorker.com,t3_cgbxeu,politics,t5_2cneq,https://www.newyorker.com/magazine/2019/07/29/the-case-of-al-franken
1051,Why They Fear Ilhan Omar: Donald Trump and Tucker Carlson don’t think she’s dangerous. They hate that she’s full of potential.,harsh2k5,slate.com,t3_cgd5xk,politics,t5_2cneq,https://slate.com/news-and-politics/2019/07/ilhan-omar-trump-tucker-carlson.html
1052,"2 officers fired for Facebook post suggesting Alexandria Ocasio-Cortez ""needs a round""",pedroxus,cbsnews.com,t3_cgjiix,politics,t5_2cneq,https://www.cbsnews.com/news/charlie-rispoli-lousiana-gretna-city-police-department-officer-alexandria-ocasio-cortez/
1053,Gretna officer who posted Alexandria Ocasio-Cortez 'needs a round' put on suspension,butthurtsnowflake,nola.com,t3_cghxtw,politics,t5_2cneq,https://www.nola.com/news/crime_police/article_fdaeb4b8-aca8-11e9-aa35-13abce94bd08.html
1054,"Elizabeth Warren, who predicted 2008 crisis, says 'warning lights are flashing' that U.S. is headed toward recession",wraithtek,usatoday.com,t3_cgdhdn,politics,t5_2cneq,https://www.usatoday.com/story/news/politics/elections/2019/07/22/recession-elizabeth-warren-warns-odds-economic-downturn-high/1792537001/
1055,"Impeachment case 'to be made by Mueller this week', as president attempts to defend his racism in press conference",Pomp_N_Circumstance,independent.co.uk,t3_cggicx,politics,t5_2cneq,https://www.independent.co.uk/news/world/americas/us-politics/trump-news-live-updates-mueller-hearing-russia-impeachment-us-president-iran-pakistan-latest-a9015066.html
1056,Asylum Seekers That Followed Trump Rule Now Don’t Qualify Because of New Trump Rule,stupidstupidreddit2,propublica.org,t3_cgh9wp,politics,t5_2cneq,https://www.propublica.org/article/asylum-seekers-that-followed-trump-rule-now-dont-qualify-because-of-new-trump-rule
1057,Two Louisiana Police Officers Were Fired Over A Facebook Post Suggesting AOC Should Be Shot,MaryWannaWeed,buzzfeednews.com,t3_cgkghw,politics,t5_2cneq,https://www.buzzfeednews.com/article/briannasacks/louisiana-police-officers-aoc-fired-facebook-gretna?ref=bfnsplash
1058,Texas Democrat Wendy Davis is running for Congress in 2020,NewsHour,pbs.org,t3_cgfo5p,politics,t5_2cneq,https://www.pbs.org/newshour/politics/texas-democrat-wendy-davis-is-running-for-congress-in-2020
1059,"Mueller to make a public case for Trump impeachment with 'very substantial evidence' in congressional hearing, committee chairman says",Antinatalista,independent.co.uk,t3_cgcaz9,politics,t5_2cneq,https://www.independent.co.uk/news/world/americas/mueller-hearing-trump-russia-report-impeachment-collusion-house-judiciary-nadler-a9014991.html
1060,Chinese investment into the US has plunged 90% since Trump took office — and poorer states may get hit the hardest,viva_la_vinyl,markets.businessinsider.com,t3_cgc7gz,politics,t5_2cneq,https://markets.businessinsider.com/news/stocks/china-investment-us-drying-up-poor-states-michigan-lose-out-2019-7-1028371155
1061,EPA refuses to ban pesticide tied to children's health problems,goombah111,edition.cnn.com,t3_cgntap,politics,t5_2cneq,https://edition.cnn.com/2019/07/18/politics/epa-chlorpyrifos/index.html
1062,The American Bar Association says US immigration courts are 'on the brink of collapse',Zetto52SD,www-m.cnn.com,t3_cgejo1,politics,t5_2cneq,https://www-m.cnn.com/2019/03/20/politics/american-bar-association-immigration-court/index.html?r=https%3A%2F%2Famp-cnn-com.cdn.ampproject.org%2Fv%2Fs%2Famp.cnn.com%2Fcnn%2F2019%2F03%2F20%2Fpolitics%2Famerican-bar-association-immigration-court%2Findex.html%3Famp_js_v%3D0.1%26usqp%3Dmq331AQCKAE%253D
1063,Trump’s Campaign Is Based On Hatred Of “The Others”,Hintonwa,washingtonpost.com,t3_cgftbr,politics,t5_2cneq,https://www.washingtonpost.com/business/2019/07/22/siemens-ceo-says-trump-is-becoming-face-racism-exclusion/?utm_term=.3a89a84b3e2f
1064,Trump administration pursues rule that would remove 3.1 million people from food stamps,hellusing,reuters.com,t3_cgodgk,politics,t5_2cneq,https://www.reuters.com/article/us-usa-trump-foodstamps/trump-administration-pursues-rule-that-would-remove-3-1-million-people-from-food-stamps-idUSKCN1UI0AH?utm_source=applenews
1065,Trump met with Nunes to talk intel chief replacements,StevenSanders90210,politico.com,t3_cgkq33,politics,t5_2cneq,https://www.politico.com/amp/story/2019/07/22/trump-nunes-intelligence-chiefs-1426698?__twitter_impression=true
1066,"Brian Stelter lays out the pattern of Trump's race baiting | CNN's Brian Stelter goes through a chronological history of Trump's race-related provocations, arguing that the press must not lose sight of this larger pattern.",2legit2fart,cnn.com,t3_cgl0fq,politics,t5_2cneq,https://www.cnn.com/videos/media/2019/07/21/brian-stelter-monologue-donald-trump-pattern-race-baiting-rs-vpx.cnn
1067,Stephen Miller's uncle repudiates his nephew's harsh stance toward immigrants,kdshow123,theweek.com,t3_cgo5jj,politics,t5_2cneq,https://theweek.com/speedreads/854312/stephen-millers-uncle-repudiates-nephews-harsh-stance-toward-immigrants
1068,The President’s Utterly Un-American Response to Dissent,News2016,acslaw.org,t3_cggo9e,politics,t5_2cneq,https://www.acslaw.org/expertforum/the-presidents-utterly-un-american-response-to-dissent/
1069,Franken says he ‘absolutely’ regrets resigning from Senate,biglou722,wsav.com,t3_cgj2g7,politics,t5_2cneq,https://www.wsav.com/news/national-news/franken-says-he-absolutely-regrets-resigning-from-senate/
1070,Column: Trump has turned the Department of Labor into the Department of Employer Rights,elguiridelocho,latimes.com,t3_cghfo2,politics,t5_2cneq,https://www.latimes.com/business/story/2019-07-22/trump-attack-on-labor
1071,Trump calls congresswomen racist day after his adviser says the term is used to silence speech,TrumpSharted,usatoday.com,t3_cghlea,politics,t5_2cneq,https://www.usatoday.com/story/news/politics/2019/07/22/donald-trump-racism-and-squad-its-not-me-its-you/1796475001/
1072,Report: Pence's trip to New Hampshire was canceled so he could avoid meeting an alleged drug dealer,WalmartVirgin,theweek.com,t3_cglcox,politics,t5_2cneq,https://theweek.com/speedreads/854303/report-pences-trip-new-hampshire-canceled-could-avoid-meeting-alleged-drug-dealer
1073,Elizabeth Warren warns another financial crisis is coming -- but she has a plan,PleaseDeleteMeToDay,cnn.com,t3_cgcq3p,politics,t5_2cneq,https://www.cnn.com/2019/07/22/politics/elizabeth-warren-financial-crisis-wall-street-economic-plan/index.html
1074,Franken says he 'absolutely' regrets resigning from Senate,seeasea,yahoo.com,t3_cgm9cz,politics,t5_2cneq,https://www.yahoo.com/news/franken-says-absolutely-regrets-resigning-201920839.html
1075,Army Lets Slip That It's Conducting Secret Operation Around D.C.,aktivate74,bloomberg.com,t3_cgf2o4,politics,t5_2cneq,https://www.bloomberg.com/news/articles/2019-07-22/army-lets-slip-that-it-s-conducting-secret-operation-around-d-c
1076,Can Mueller Cut Through Barr’s ‘Fog of Propaganda’?,aubonpaine,thedailybeast.com,t3_cgml8n,politics,t5_2cneq,https://www.thedailybeast.com/robert-mueller-hearing-can-the-special-counsel-cut-through-william-barrs-fog-of-propaganda
1077,"DOJ tells Mueller to limit testimony to his report, sources say",freddiethebaer,politico.com,t3_cgio0t,politics,t5_2cneq,https://www.politico.com/story/2019/07/22/justice-mueller-congress-testimony-limit-1426035
1078,Trump Plans to Deport Thousands of New Migrants Without Due Process,Pomp_N_Circumstance,news.vice.com,t3_cgf563,politics,t5_2cneq,https://news.vice.com/en_us/article/kzmm8e/trump-plans-to-deport-thousands-of-new-migrants-without-due-process
1079,"When modern conservatives associate activists of color with communism, they’re drawing on a racist history that goes back over 100 years.",Bakedschwarzenbach,slate.com,t3_cghvzr,politics,t5_2cneq,https://slate.com/news-and-politics/2019/07/lindsey-graham-ocasio-cortez-black-activism-communism.html
1080,"'The People Have Spoken': Estimated 400,000 Puerto Ricans Flood Streets to Demand Rosselló Resign Immediately | ""For him to think he can keep governing for another year and a half as if nothing has happened is insulting to our core.""",anitachance,commondreams.org,t3_cgi58t,politics,t5_2cneq,https://www.commondreams.org/news/2019/07/22/people-have-spoken-estimated-400000-puerto-ricans-flood-streets-demand-rossello
1081,"ICE tries to bring man in Hermitage in custody, neighbors form human chain to let them get home",StellarTabi,newschannel5.com,t3_cgiabi,politics,t5_2cneq,https://www.newschannel5.com/news/ice-agents-involved-in-a-traffic-stop-in-hemitage
1082,A Yazidi woman from Iraq told Trump that ISIS killed her family. ‘Where are they now?’ he asked.,Aschebescher,washingtonpost.com,t3_cgmn2y,politics,t5_2cneq,https://www.washingtonpost.com/politics/a-yazidi-woman-from-iraq-told-trump-that-isis-killed-her-family-where-are-they-now-he-asked/2019/07/19/cc0c83e0-aa2d-11e9-a3a6-ab670962db05_story.html
1083,Rudy’s Private “Soldiers Of Fortune”: Inside Giuliani’s Ukrainian Campaign To Keep Trump In The White House,ginger_bredman,buzzfeednews.com,t3_cgbahi,politics,t5_2cneq,https://www.buzzfeednews.com/article/mikesallah/rudy-giuliani-ukraine-trump-parnas-fruman
1084,Country Station Refuses to Air Pete Buttigieg Interview,____________,advocate.com,t3_cgfb3m,politics,t5_2cneq,https://www.advocate.com/politics/2019/7/22/country-station-refuses-air-pete-buttigieg-interview
1085,Elizabeth Warren warns that Trump may trigger economic meltdown,Stevensew,cbsnews.com,t3_cgdc7s,politics,t5_2cneq,https://www.cbsnews.com/news/elizabeth-warren-warns-that-trump-may-trigger-economic-meltdown/
1086,The Trump Administration Is Moving to End Food Stamps for 3 Million People,dingo8yobb,time.com,t3_cgpipe,politics,t5_2cneq,https://time.com/5632313/trump-food-stamps-new-regulations/
1087,Popular Country Music Radio Station Killed A Buttigieg Interview Under False Pretenses,echo249,talkingpointsmemo.com,t3_cggbit,politics,t5_2cneq,https://talkingpointsmemo.com/news/country-music-radio-buttigieg-interview-fcc-equal-time
1088,The Banality of Lindsey Graham: Why did the senator switch from anti-Trump to the president's biggest supporter in Congress? Perhaps it's not a mystery after all.,harsh2k5,newrepublic.com,t3_cgdb69,politics,t5_2cneq,https://newrepublic.com/article/154501/banality-lindsey-graham-biggest-trump-supporter-congress
1089,"Bernie Sanders Introduces ""Right To A Secure Retirement"" Plan",Bern_Baby_Bern_,democracynow.org,t3_cgiumt,politics,t5_2cneq,https://www.democracynow.org/2019/7/22/headlines/bernie_sanders_introduces_right_to_a_secure_retirement_plan
1090,Fox's fixation with Ocasio-Cortez and Omar,2legit2fart,cnn.com,t3_cgl9iz,politics,t5_2cneq,https://www.cnn.com/videos/business/2019/07/21/foxs-fixation-with-ocasio-cortez-and-omar.cnn/video/playlists/business-reliable-sources/
1091,Trump Might Use the G-7 Summit to Bail Out His Struggling Golf Club,billthomson,motherjones.com,t3_cgj38a,politics,t5_2cneq,https://www.motherjones.com/politics/2019/07/trump-might-use-the-g-7-summit-to-bail-out-his-struggling-golf-club/
1092,Puerto Ricans embrace their protest identity in historic march against the governor,sacundim,miamiherald.com,t3_cgmuka,politics,t5_2cneq,https://www.miamiherald.com/news/nation-world/world/americas/article232960867.html
1093,Trump administration's 'scientific oppression' threatens US safety and innovation,sketch24,usatoday.com,t3_cgbpgz,politics,t5_2cneq,https://www.usatoday.com/story/opinion/2019/07/22/donald-trump-war-on-science-hurts-america-and-americans-column/1765301001/
1094,Note to G7 guests: Trump Doral pools have not been inspected by health officials,Quezaday,qz.com,t3_cggp07,politics,t5_2cneq,https://qz.com/1671920/note-to-g7-health-officials-havent-inspected-trump-doral-pools/
1095,Congressman Dan Crenshaw delivers wholly misleading attack on the minimum wage,TruthSeeker402,thinkprogress.org,t3_cgdzf9,politics,t5_2cneq,https://thinkprogress.org/gop-congressman-lies-about-minimum-wage-6851fc4d421c/
1096,O'Rourke calls Trump event 'almost an impromptu Nuremberg rally' after 'send her back' chants,garbage_io,thehill.com,t3_cglmwd,politics,t5_2cneq,https://thehill.com/homenews/campaign/454236-orourke-calls-trump-rally-almost-an-impromptu-nuremberg-rally-after-send
1097,Trump says congresswomen 'can't get away' with speech he doesn't like,Stoomqrvc,msnbc.com,t3_cgdx1p,politics,t5_2cneq,http://www.msnbc.com/rachel-maddow-show/trump-says-congresswomen-cant-get-away-speech-he-doesnt
1098,Wilbur Ross is literally falling asleep on the job,woclord,salon.com,t3_cgejpb,politics,t5_2cneq,https://www.salon.com/2019/07/22/wilbur-ross-is-literally-falling-asleep-on-the-job/
1099,"Under Trump, 26% of Climate Change References Have Vanished From .Gov Sites",mvea,vice.com,t3_cgpsb1,politics,t5_2cneq,https://www.vice.com/en_uk/article/kzmmwe/under-trump-26-of-climate-change-references-have-vanished-from-gov-sites
1100,"Even if Mueller sticks to his report, experts say testimony could have impact",pm-me-your-dad-jokes,abc6onyourside.com,t3_cgjlo2,politics,t5_2cneq,http://abc6onyourside.com/news/nation-world/even-if-mueller-sticks-to-his-report-experts-say-testimony-could-have-impact
1101,Pizzagater Jack Posobiec Granted Fellowship By Increasingly White Nationalist Think Tank,Jonny43,rightwingwatch.org,t3_cggh7a,politics,t5_2cneq,http://www.rightwingwatch.org/post/pizzagater-jack-posobiec-granted-fellowship-by-increasingly-white-nationalist-think-tank/
1102,USDA proposes SNAP change that would push 3 million Americans off food stamps,AnonymousTank,washingtonpost.com,t3_cgo1gv,politics,t5_2cneq,https://www.washingtonpost.com/business/2019/07/23/usda-proposes-snap-change-that-would-push-million-americans-off-food-stamps/?hpid=hp_hp-more-top-stories_snap-cut-1215am%3Ahomepage%2Fstory-ans&amp;noredirect=on&amp;utm_term=.316ee799f71a
