,data.title,data.author,data.domain,data.name,data.subreddit,data.subreddit_id,data.url
1503,Trump Says He Wants To Meet With Schumer ‘ASAP’ Following Senator's 'Awful' Border Visit,rjperez13,huffpost.com,t3_cgc2h4,politics,t5_2cneq,https://www.huffpost.com/entry/trump-schumer-border-visit-detention_n_5d352671e4b0419fd32ed764
1504,Democrats Kick Off Campaign to Undercut Trump’s Economic Record,Clayion,bloomberg.com,t3_cge5kr,politics,t5_2cneq,https://www.bloomberg.com/news/articles/2019-07-22/democrats-kick-off-campaign-to-undercut-trump-s-economic-record
1505,Ocasio-Cortez Calls for “9/11-Style Commission” to Investigate Family Separation at Border,viva_la_vinyl,slate.com,t3_cg09rt,politics,t5_2cneq,https://slate.com/news-and-politics/2019/07/ocasio-cortez-calls-9-11-style-commission-family-separation.html
1506,Trump calls for US interest rate cut; fears of UK Brexit recession – as it happened,Jerryopt,theguardian.com,t3_cgeyn0,politics,t5_2cneq,https://www.theguardian.com/business/live/2019/jul/22/markets-geopolitical-tensions-brexit-oil-sterling-ftse-germany-business-live
1507,CNN’s debate draft special shows cable news has learned nothing from 2016,CuentasSonInutiles,vox.com,t3_cg8kg1,politics,t5_2cneq,https://www.vox.com/culture/2019/7/21/20701415/cnn-debate-draft-the-draw-democratic-debates-july
1508,Abortion laws get more attention in the culture wars,wheeler1432,economist.com,t3_cgegyp,politics,t5_2cneq,https://www.economist.com/united-states/2019/07/20/abortion-laws-get-more-attention-in-the-culture-wars?fsrc=scn/fb/te/bl/ed/abortionlawsgetmoreattentionintheculturewarstheotherkindofprochoice&amp;fbclid=IwAR2FgRSY5WKqfkF4SGtFDVI0pkKLGAQ3JVWiJlzra9MIbIntv-n4BUTRX9g
1509,Siemens CEO Calls Trump the Face of ‘Racism and Exclusion,Fr1sk3r,bloomberg.com,t3_cfynmh,politics,t5_2cneq,https://www.bloomberg.com/news/articles/2019-07-20/siemens-ceo-calls-trump-the-face-of-racism-and-exclusion
1510,"Drug prices now over $80K a year for chronic conditions. Here's how to fight back, lower prices",MTDreams123,click2houston.com,t3_cg81tj,politics,t5_2cneq,https://www.click2houston.com/news/investigates/drug-prices-now-over-80k-a-year-for-chronic-conditions-here-s-how-to-fight-back-lower-prices
1511,Trump met with Pakistani PM Imran Khan in an effort to mend ties | BBC,CyberKnightX,bbc.com,t3_cgh9oq,politics,t5_2cneq,https://www.bbc.com/news/world-us-canada-49032495
1512,"As vice president, Biden said Ukraine should increase gas production. Then his son got a job with a Ukrainian gas company.",sketch24,washingtonpost.com,t3_cgbxb5,politics,t5_2cneq,https://www.washingtonpost.com/politics/as-vice-president-biden-said-ukraine-should-increase-gas-production-then-his-son-got-a-job-with-a-ukrainian-gas-company/2019/07/21/f599f42c-86dd-11e9-98c1-e945ae5db8fb_story.html
1513,The people of Puerto Rico are angry: Here is what's fueling a major protest planned for Monday,boc1892,usatoday.com,t3_cgbanl,politics,t5_2cneq,https://www.usatoday.com/story/news/nation/2019/07/21/puerto-rico-protest-monday-what-you-should-know/1790087001/
1514,Democrat Elijah Cummings says his constituents are ‘scared’ of Trump after racist tweets,Garymrba,independent.co.uk,t3_cg1cfp,politics,t5_2cneq,https://www.independent.co.uk/news/world/americas/us-politics/trump-racism-elijah-cummings-aoc-ilhan-omar-go-back-chants-a9014466.html
1515,What type of fascism is driving the far right today?,literallytreesus,aljazeera.com,t3_cg5ga4,politics,t5_2cneq,https://www.aljazeera.com/indepth/opinion/type-fascism-driving-today-190716082444318.html?fbclid=IwAR0JZvZ_Ny4Y_aZgKjhU5ZrqNLh2PzyU4HRAEm3meMIgSCvtt7vaAQ3f9-8
1516,The Border Patrol–to–Emergency Room Pipeline | The conditions in facilities at the border are so dire that many migrants are in need of medical care as soon as they are released.,Special_Agent_Foles,theatlantic.com,t3_cfy4pl,politics,t5_2cneq,https://www.theatlantic.com/family/archive/2019/07/border-crisis-reaches-emergency-rooms/594160/
1517,Kamala Harris and Elizabeth Warren are on a 2020 collision course,SuccessfulOperation,mcclatchydc.com,t3_cgh3hc,politics,t5_2cneq,https://www.mcclatchydc.com/news/politics-government/election/campaigns/article232964237.html
1518,Why did Kamala Harris pick Baltimore for presidential campaign headquarters? ‘It is like a sister city’,aresef,baltimoresun.com,t3_cgh30o,politics,t5_2cneq,https://www.baltimoresun.com/politics/bs-md-pol-kamala-harris-baltimore-20190722-q222qf5l7vfbfn73zwrjdblcvy-story.html
1519,"After post about ‘the jihad squad,’ on GOP Facebook page, Illinois Republican leaders denounce race-based appeal",PepeBabinski,chicago.suntimes.com,t3_cg8xmc,politics,t5_2cneq,https://chicago.suntimes.com/columnists/2019/7/21/20703265/post-about-jihad-squad-gop-facebook-page-illinois-republican-leaders-denounce-race-based-appeal
1520,Puerto Rico prepares for massive protest to expel governor,net-diver,apnews.com,t3_cgaso8,politics,t5_2cneq,https://apnews.com/9628a151610840dd93c3b0e3e65ecf9b
1521,Adam Schiff Is Back From the Wilderness,PoliticallyFit,theatlantic.com,t3_cgd0nv,politics,t5_2cneq,https://www.theatlantic.com/politics/archive/2019/07/adam-schiff-mueller-testimony/594406/
1522,"The Hill's Morning Report — Mueller Time: Dems, GOP ready questions for high-stakes testimony",Yibblets,thehill.com,t3_cgbn7j,politics,t5_2cneq,https://thehill.com/homenews/morning-report/454093-the-hills-morning-report
1523,Pete Buttigieg warns White Supremacy could end the U.S. like it almost did in the Civil War.,drsleep007,newsweek.com,t3_cg25ev,politics,t5_2cneq,https://www.newsweek.com/pete-buttigieg-white-supremacy-could-end-us-like-civil-war-1450377
1524,What if Robert Mueller decided to tell Congress what he really thinks?,PepeBabinski,usatoday.com,t3_cgabqb,politics,t5_2cneq,https://www.usatoday.com/story/opinion/2019/07/22/imagine-mueller-secret-thoughts-trump-russia-republicans-democrats-column/1736270001/?utm_source=feedblitz&amp;utm_medium=FeedBlitzRss&amp;utm_campaign=news-opinion
1525,Puerto Rico: Ricardo Rosselló resigns as party president over text messages,pipsdontsqueak,theguardian.com,t3_cg4tbr,politics,t5_2cneq,https://www.theguardian.com/world/2019/jul/21/puerto-rico-governor-ricardo-rossello-resigns-protests?CMP=Share_AndroidApp_reddit_is_fun
1526,Appeals Court Upholds Trump Move to Drop Mine Pollution Rule,KiDDONNAViCiOUS,usnews.com,t3_cg84et,politics,t5_2cneq,https://www.usnews.com/news/business/articles/2019-07-19/appeals-court-upholds-trump-move-to-drop-mine-pollution-rule
1527,"Drug company executives said they didn’t contribute to the opioid epidemic. Nearly 2,000 communities say otherwise.",temporarycreature,washingtonpost.com,t3_cg26ps,politics,t5_2cneq,https://www.washingtonpost.com/nation/2019/07/20/drug-companies-executives-said-they-didnt-contribute-opioid-epidemic-nearly-communities-say-otherwise/?utm_term=.2e0fd501e5eb
1528,Racism Is an Impeachable Offense,brithus,theintercept.com,t3_cfufz9,politics,t5_2cneq,https://theintercept.com/2019/07/19/trump-racism-impeachment-offense/
1529,Fox’s Chris Wallace Confronts WH Adviser Stephen Miller: ‘No Question’ Trump’s ‘Stoking Racial Divisions’,Antinatalista,thedailybeast.com,t3_cg0hwe,politics,t5_2cneq,https://www.thedailybeast.com/foxs-chris-wallace-confronts-wh-adviser-stephen-miller-no-question-trumps-stoking-racial-divisions
1530,"Losing the leadership of the free world: Thirty years ago, it was easy to believe when Reagan said that America was a 'beacon of freedom'. Nobody's buying it today.",EvidenceBase2000,macleans.ca,t3_cg224r,politics,t5_2cneq,https://www.macleans.ca/opinion/losing-the-leadership-of-the-free-world/
1531,"Iran claims they arrested 17 nationals working with CIA to spy on nuclear, military sites",TorkNowell,nypost.com,t3_cgildm,politics,t5_2cneq,https://nypost.com/2019/07/22/iran-arrested-17-nationals-working-with-cia-to-spy-on-nuclear-military-sites/
1532,Phil Mudd: Here's what Bob Mueller will do if Republicans attack - CNN Video,sillytrail882,cnn.com,t3_cggaup,politics,t5_2cneq,https://www.cnn.com/videos/politics/2019/07/19/phil-mudd-robert-mueller-hearing-integrity-sot-tsr-vpx.cnn
1533,"Puerto Rico governor says will not seek re-election, but refuses to resign over chats",dottiemommy,reuters.com,t3_cg6j31,politics,t5_2cneq,https://www.reuters.com/article/us-usa-puertorico/puerto-rico-governor-says-will-not-seek-re-election-but-refuses-to-resign-over-chats-idUSKCN1UG0QO?il=0
1534,Fox News host decimates Trump aide’s defense of racism and hypocrisy,skye_kunhavigi,thinkprogress.org,t3_cfzmjc,politics,t5_2cneq,https://thinkprogress.org/fox-news-host-decimates-trump-aide-stephen-miller-racism-hypocricy-8a8b7b4b5db3/
1535,Louisiana Police Officer on Facebook Says Alexandria Ocasio-Cortez ‘Needs a Round’,CuentasSonInutiles,nytimes.com,t3_cg7isr,politics,t5_2cneq,https://www.nytimes.com/2019/07/21/us/charlie-rispoli-gretna-police.html
1536,Virginia Lawmakers Spar on Reported Trump Visit to Jamestown. Democrats have threatened to boycott the event because they say Trump doesn't represent their values — a reaction the Republican Senate majority leader calls disappointing and embarrassing.,GreyhoundsAreFast,nbcwashington.com,t3_cgf8tj,politics,t5_2cneq,https://www.nbcwashington.com/news/local/Virginia-Lawmakers-Spar-on-Reported-Trump-Visit-to-Jamestown-513028651.html
1537,History Will Honor the Courageous 95 Who Proposed to Impeach a Racist President. It is absolutely appropriate for members of the US House to check and balance a president who employs xenophobic hatred to divide a nation.,mixplate,thenation.com,t3_cfv9t5,politics,t5_2cneq,https://www.thenation.com/article/trump-racism-impeachment/
1538,Kirsten Gillibrand Thinks a Bus Tour Will Help Her Floundering Campaign,MeghanMcCain-sucks,news.vice.com,t3_cgdy3p,politics,t5_2cneq,https://news.vice.com/en_us/article/bj9qaw/kirsten-gillibrand-thinks-a-bus-tour-will-help-her-floundering-campaign
1539,"Iran claims it's nabbed 17 CIA spies, sentenced some to death",CrotalusHorridus,cbsnews.com,t3_cgd32b,politics,t5_2cneq,https://www.cbsnews.com/news/iran-cia-spies-nabbed-17-sentenced-some-to-death-today-2019-07-22/
1540,Elizabeth Warren Has Momentum. Can She Build a Movement?,SuccessfulOperation,theatlantic.com,t3_cfzpzz,politics,t5_2cneq,https://www.theatlantic.com/politics/archive/2019/07/warren-democrat-2020/594430/
1541,"Why We Must Restore the Title, “War Department”",Crawl-Walk-Run,commondreams.org,t3_cgbz6d,politics,t5_2cneq,https://www.commondreams.org/views/2019/07/20/why-we-must-restore-title-war-department
1542,Swedish prime minister warns Donald Trump he cannot influence ASAP Rocky judicial process,tisacrazyworld,telegraph.co.uk,t3_cg06bs,politics,t5_2cneq,https://www.telegraph.co.uk/news/2019/07/20/swedish-prime-minister-warns-donald-trump-cannot-influence-asap/
1543,"Schiff, the House intelligence chair, says he first learned of Russian attacks on Senate campaigns at a security forum",qpdjoakdkwopq,washingtonpost.com,t3_cg3z8y,politics,t5_2cneq,https://www.washingtonpost.com/politics/2019/07/21/schiff-house-intelligence-chair-says-he-first-learned-russian-attacks-senate-campaigns-security-forum/
1544,Rep. Elijah Cummings: 'No Doubt' Donald Trump Is A Racist,trumpmypresident,huffpost.com,t3_cg0vb2,politics,t5_2cneq,https://www.huffpost.com/entry/elijah-cummings-trump-racist_n_5d34704be4b0419fd32e4a3c
1545,Ocasio-Cortez calls for an independent investigation into child separation policies,wbedwards,vox.com,t3_cg0muj,politics,t5_2cneq,https://www.vox.com/policy-and-politics/2019/7/21/20702666/alexandria-ocasio-cortez-independent-investigation-comission-child-separation-policies-donald-trump
1546,"He Wasn’t Seeking to Kill a Mob Boss. He Was Trying to Help Trump, His Lawyer Says.",nanopicofared,nytimes.com,t3_cg35bk,politics,t5_2cneq,https://www.nytimes.com/2019/07/21/nyregion/gambino-shooting-anthony-comello-frank-cali.html
1547,The Anti-Trump Resistance Has Spawned a New Crop of Hucksters | “Grifting has some kind of negative intent. We’re patriots.”,deraser,motherjones.com,t3_cgdlam,politics,t5_2cneq,https://www.motherjones.com/politics/2019/07/scott-dworkin-restistance/
1548,One of the biggest antigay activists says Trump’s human rights commission is their ‘opportunity’ - The famous Christian conservative activist says Trump's new 'human rights' commission will be a once-in-a-lifetime opportunity to roll back LGBTQ equality.,Karma-Kosmonaut,lgbtqnation.com,t3_cg0uuf,politics,t5_2cneq,https://www.lgbtqnation.com/2019/07/one-biggest-antigay-activists-says-trumps-human-rights-commission-opportunity/
1549,Two Democrats vow to press forward on Trump impeachment,brithus,thehill.com,t3_cg29ls,politics,t5_2cneq,https://thehill.com/homenews/house/453954-two-democrats-vow-to-press-forward-on-trump-impeachment
1550,Deadlock continues as Alaska House Republicans oppose capital budget fix and ‘reverse sweep’,pipsdontsqueak,adn.com,t3_cg766z,politics,t5_2cneq,https://www.adn.com/politics/alaska-legislature/2019/07/22/alaska-house-republicans-nix-fix-for-broken-capital-budget-and-reverse-sweep/
1551,Reformist District Attorney Larry Krasner Argues Pennsylvania Death Penalty Is Unconstitutional,Crawl-Walk-Run,theintercept.com,t3_cg9ics,politics,t5_2cneq,https://theintercept.com/2019/07/15/larry-krasner-pennsylvania-death-penalty-unconstitutional/
1552,Iranian officials say 17 arrested spies were U.S.-trained,rambosk,nbcnews.com,t3_cgb2p1,politics,t5_2cneq,https://www.nbcnews.com/news/world/iranian-officials-say-17-alleged-u-s-spies-captured-some-n1032216?cid=sm_npd_nn_tw_ma
1553,How An Anonymous Democratic Poll Became A Trump Talking Point,Georgeytv,talkingpointsmemo.com,t3_cgg6u0,politics,t5_2cneq,https://talkingpointsmemo.com/news/anonymous-democratic-poll-in-axios-becomes-trump-talking-point
1554,More than half of Americans approve of Trump on the economy. More than half also say they won’t vote for him.,rabbi01011,washingtonpost.com,t3_cglpnw,politics,t5_2cneq,https://www.washingtonpost.com/politics/2019/07/22/more-than-half-americans-approve-trump-economy-more-than-half-also-say-they-wont-vote-him/?noredirect=on&amp;utm_term=.99c6e4790fc3
1555,Ted Cruz: 'Fox News went all in for Trump',missmegz1492,thehill.com,t3_cg2z17,politics,t5_2cneq,https://thehill.com/blogs/blog-briefing-room/news/454068-ted-cruz-fox-news-went-all-in-for-trump
1556,Mike Pence to attend Aspen fundraiser Monday that sources say will be held at a private club owned by two gay men,anarchytravel,denverpost.com,t3_cg1h6b,politics,t5_2cneq,https://www.denverpost.com/2019/07/21/mike-pence-aspen-fundraiser-caribou-club/
1557,Neurotoxins on your kid's broccoli: that's life under Trump,sketch24,theguardian.com,t3_cfy7x9,politics,t5_2cneq,https://www.theguardian.com/commentisfree/2019/jul/21/epa-chlorpyrifos-trump-food
1558,Ben Carson admits that black Americans are struggling in Trump’s economy,Captainstinkytits,thinkprogress.org,t3_cg1xht,politics,t5_2cneq,https://thinkprogress.org/ben-carson-admits-that-black-americans-are-struggling-in-trumps-economy-62eb96c8eb5b/
1559,Trump Administration Announces Changes to Citizenship Test,ClownsToTheRightOfMe,theroot.com,t3_cg7j6p,politics,t5_2cneq,https://www.theroot.com/trump-administration-announces-changes-to-citizenship-t-1836578752
1560,Illinois GOP accuses four Democratic congresswomen of ‘jihad’,skye_kunhavigi,thinkprogress.org,t3_cg22o7,politics,t5_2cneq,https://thinkprogress.org/illinois-gop-accuses-four-democratic-congresswomen-of-jihad-1ec666c03015/
1561,Republicans spent the week being asked about racism. Their definitions of it were all over the map.,rakibhasantusar,washingtonpost.com,t3_cfyo18,politics,t5_2cneq,https://www.washingtonpost.com/politics/2019/07/21/republicans-spent-week-being-asked-about-racism-their-definitions-it-were-all-over-map/?noredirect=on#click=https://t.co/xsc5ZW1Fls
1562,Report: Pence To Attend Fundraiser At Club Owned By Two Gay Men,Austin63867,talkingpointsmemo.com,t3_cg4gdl,politics,t5_2cneq,https://talkingpointsmemo.com/news/pence-fundraiser-club-owned-two-gay-men
1563,"Trump Announces Deal On Debt Limit, Spending Caps",cram213,m.huffpost.com,t3_cgl6o7,politics,t5_2cneq,https://m.huffpost.com/us/entry/us_5d30c131e4b004b6adacffcb
1564,"How Donald Trump is breaking the law - The writ of the courts still runs—for now. But Trump is remaking the American bench, and destroying the norms on which democracy depends",News2016,prospectmagazine.co.uk,t3_cfytj6,politics,t5_2cneq,https://www.prospectmagazine.co.uk/magazine/how-donald-trump-is-breaking-the-law-united-states-white-house-president
1565,Schiff: We Need Mueller’s Testimony So He Can Clearly Lay Out His Report To The Public,wonderingsocrates,talkingpointsmemo.com,t3_cg1rol,politics,t5_2cneq,https://talkingpointsmemo.com/news/schiff-mueller-testimony-lay-out-facts-report
1566,SE Cupp: GOP is responsible for Trump's 'racist' and 'un-American ideas',Eleganty,thehill.com,t3_cfyujk,politics,t5_2cneq,https://thehill.com/homenews/media/454031-se-cupp-gop-is-responsible-for-trumps-racist-and-un-american-ideas
1567,Trump Denies Iran Has Captured 17 CIA Spies,snowflake25911,npr.org,t3_cggdae,politics,t5_2cneq,https://www.npr.org/2019/07/22/744063702/trump-denies-iran-has-captured-17-cia-spies
1568,Trump repeatedly asks NASA administrator why we can’t go straight to Mars,loopdieloop,theverge.com,t3_cfu4y0,politics,t5_2cneq,https://www.theverge.com/platform/amp/2019/7/19/20701061/president-trump-nasa-administrator-jim-bridenstine-artemis-mars-direct-moon-apollo-11
1569,"As The US Debates “Concentration Camps,” These Jews Are Trying To Actually Shut Them Down",silence7,buzzfeednews.com,t3_cfux6s,politics,t5_2cneq,https://www.buzzfeednews.com/article/juliareinstein/jews-against-ice-never-again-immigration-concentration-camp
1570,Alan Dershowitz Doubles-Down on Attacks of Accuser’s Attorney — Goes Low,Gambit08,lawandcrime.com,t3_cg2b9o,politics,t5_2cneq,https://lawandcrime.com/high-profile/alan-dershowitz-epstein-accusers-attorney-has-a-terrible-reputation-of-inappropriate-sex/
1571,"Racism, Inc.: How Donald Trump profits from xenophobia",mepper,salon.com,t3_cfyi8d,politics,t5_2cneq,https://www.salon.com/2019/07/21/racism-inc-how-donald-trump-profits-from-xenophobia/
1572,"In key Senate races, Democrats buck leftward tilt on issues",JackFisherBooks,apnews.com,t3_cgblhj,politics,t5_2cneq,https://www.apnews.com/3c2a32d024a34f178a85d9dc0fc13ae0
1573,"The Weaponization of National Belonging, from Nazi Germany to Trump",Majnum,newyorker.com,t3_cg25j6,politics,t5_2cneq,https://www.newyorker.com/news/our-columnists/the-weaponization-of-national-belonging-from-nazi-germany-to-trump
1574,"Trump announces $1.37 trillion budget deal with Democrats, avoiding new shutdown",Webmaster_Moderator,abc7.com,t3_cgkjhg,politics,t5_2cneq,https://abc7.com/politics/trump-announces-$137-trillion-budget-deal-with-democrats/5411839/?fbclid=IwAR0OPplYBzx8LjDvOMy1gEhzSlxZEt_YONKzq9tWGSOa4kshcKbwqvEe4Sw
1575,Former Arizona state Senate staffer wins $1 million discrimination lawsuit,boc1892,usatoday.com,t3_cg4kky,politics,t5_2cneq,https://www.usatoday.com/story/news/nation/2019/07/21/former-arizona-senate-democratic-staffer-talonya-adams-awarded-1-million-discrimination-lawsuit/1790641001/
1576,Bill Would Make Massachusetts First In US To Ban Flavored Tobacco Products,throwaway_06-20,boston.cbslocal.com,t3_cg4x3b,politics,t5_2cneq,https://boston.cbslocal.com/2019/07/20/bill-massachusetts-first-us-potential-ban-flavored-tobacco-products/
1577,Gov. Steve Bullock calls 'send her back' chants 'a stain on this presidency',WashingtonQuarter,abcnews.go.com,t3_cg1018,politics,t5_2cneq,https://abcnews.go.com/Politics/gov-steve-bullock-calls-send-back-chants-stain/story?id=64447855
1578,The Man Who Sold America: Joy-Ann Reid hosts a Trump house of horrors,Geraldinbw,theguardian.com,t3_cg2i3f,politics,t5_2cneq,https://www.theguardian.com/us-news/2019/jul/21/the-man-who-sold-america-joy-ann-reid-trump
1579,Rep. Elijah Cummings: Trump's 'go back' comments bring back painful memories of childhood racism,Steveneswc,edition.cnn.com,t3_cg3vty,politics,t5_2cneq,https://edition.cnn.com/2019/07/21/politics/elijah-cummings-racism-memories-donald-trump-comments/index.html
1580,Chris Wallace Confronted Stephen Miller Over Trump's Racist Tweets,wonderingsocrates,esquire.com,t3_cg323l,politics,t5_2cneq,https://www.esquire.com/news-politics/a28459950/chris-wallace-stephen-miller-trump-squad/
1581,It's Mueller time! The 5 top 2020 storylines to watch this week,dingo8yobb,cnn.com,t3_cg4vww,politics,t5_2cneq,https://www.cnn.com/2019/07/21/politics/mueller-congress-2020-campaign-storylines/index.html
1582,Why are we permitting federal child abuse at our border?,Karma-Kosmonaut,thehill.com,t3_cfum2t,politics,t5_2cneq,https://thehill.com/opinion/immigration/453529-why-are-we-permitting-federal-child-abuse-at-our-border
1583,Ilhan Omar's trial by political firestorm. Somali-American congresswoman has had a rapid rise and is now at centre of Trump's battle with Democrats.,drsleep007,cbc.ca,t3_cg4ys0,politics,t5_2cneq,https://www.cbc.ca/news/world/ilhan-omar-profile-1.5218863
1584,"Most Americans disagree with Trump's ""go back"" tweets — CBS News poll",OutThinkz,cbsnews.com,t3_cfzlyo,politics,t5_2cneq,https://www.cbsnews.com/news/most-americans-disagree-with-trumps-go-back-tweets-cbs-news-poll/
1585,"Justin Bieber: I appreciate Trump helping A$AP Rocky, but 'can you also let those kids out of cages?'",Treasonmanbad,cnn.com,t3_cfs5qb,politics,t5_2cneq,https://www.cnn.com/2019/07/20/entertainment/justin-bieber-donald-trump-asap-rocky-trnd/index.html?utm_source=feedburner&amp;utm_medium=feed&amp;utm_campaign=Feed%3A+rss%2Fcnn_latest+%28RSS%3A+CNN+-+Most+Recent%29
1586,Megan Rapinoe Slams “Send Her Back” Chants as “Disgusting and Despicable”,StevenSanders90210,motherjones.com,t3_cg0mz4,politics,t5_2cneq,https://www.motherjones.com/politics/2019/07/megan-rapinoe-trump-disgusting/
1587,Barney Frank Defends Nancy Pelosi from Her Critics,SuccessfulOperation,newyorker.com,t3_cgjpmy,politics,t5_2cneq,https://www.newyorker.com/news/q-and-a/barney-frank-defends-nancy-pelosi-from-her-critics
1588,Trump Continues Attacking Democratic Congresswomen’s Patriotism,Treasonmanbad,motherjones.com,t3_cg02y2,politics,t5_2cneq,https://www.motherjones.com/politics/2019/07/trump-loving-our-country/
1589,"Deal sealed on federal budget, ensuring no shutdown, default",ReverseWho,apnews.com,t3_cglkqv,politics,t5_2cneq,https://apnews.com/b72be6c420bb478ea469da72c73065e2
1590,Gay-owned club hosting VIP fundraiser for Mike Pence and the Republican Party,Ph_Speed,newsweek.com,t3_cgiv8f,politics,t5_2cneq,https://www.newsweek.com/mike-pence-aspen-colorado-gay-club-pitkin-county-lgbt-caribou-club-1450577?utm_source=Public&amp;utm_medium=Feed&amp;utm_campaign=Distribution
1591,Trump administration disputes claims that president’s attacks on Democratic lawmakers are racist,racist_in_chief_,msnbc.com,t3_cg7igh,politics,t5_2cneq,http://www.msnbc.com/kasie-dc/watch/trump-administration-disputes-claims-that-president-s-attacks-on-democratic-lawmakers-are-racist-64258629895
1592,"Even Nice, “Generous” Rich People Are Not Your Friends - Rich people love to give away money for charitable causes to convince you that they’re not so bad after all. Don’t be fooled: we need to dispossess the benevolent rich of their ill-gotten gains, too.",Dondonponpon,jacobinmag.com,t3_cg0htg,politics,t5_2cneq,https://www.jacobinmag.com/2019/07/howard-buffett-gates-foundation-bernie-sanders?fbclid=IwAR3poZ6coKhXC9A4II4wFdAWaYldAz7Mv7UWH5tAESXTgDr_faylWCBTURw
1593,Trump administration plans to make changes to U.S. citizenship test,jfshay,axios.com,t3_cg5hei,politics,t5_2cneq,https://www.axios.com/us-citizenship-test-trump-plans-changes-c5073873-0194-4a44-bf67-811dd5ac1ee3.html
1594,Trump v. Congress: Trump's Top Lawyer ‘Should Brush Up On The Law’ | The Last Word | MSNBC,Gregoriosae,youtube.com,t3_cg49su,politics,t5_2cneq,https://www.youtube.com/watch?v=BCuikkdZ9Gc
1595,"Dante, Trump and the moral cowardice of the G.O.P.",Mrtw33tums,americamagazine.org,t3_cfznor,politics,t5_2cneq,https://www.americamagazine.org/politics-society/2019/07/21/dante-trump-and-moral-cowardice-gop
1596,Cupp calls out Republicans: What a load of crap,Next_Hammer,youtube.com,t3_cg47ow,politics,t5_2cneq,https://www.youtube.com/watch?v=GPhWw7ZxNN0#t=01m34s
1597,"Pence says Trump ""might make an effort"" to stop ""send her back"" chants in the future",rambosk,cbsnews.com,t3_cg8nbk,politics,t5_2cneq,https://www.cbsnews.com/news/mike-pence-interview-on-face-the-nation-pence-says-trump-might-make-an-effort-to-stop-future-chants/?ftag=COS-05-10aaa0g&amp;utm_campaign=trueAnthem:+Trending+Content&amp;utm_content=5d352b0beb25fa0001bea319&amp;utm_medium=trueAnthem&amp;utm_source=twitter
1598,Kamala Harris Blasts—And Takes Money From—Jeffrey Epstein's Law Firm,illuminato-x,fortune.com,t3_cgprzo,politics,t5_2cneq,https://fortune.com/2019/07/15/kamala-harris-jeffrey-epstein-law-firm/
1599,"As Trump’s reliable sycophant, Rubio drags us further into the president’s swamp",truffs1010,miamiherald.com,t3_cg0rnt,politics,t5_2cneq,https://www.miamiherald.com/opinion/op-ed/article232932157.html
1600,Nadler: Mueller hearing focus on Trump wrongdoing evidence,sillytrail882,wsbtv.com,t3_cg3ayl,politics,t5_2cneq,https://www.wsbtv.com/news/national-news/ap-top-news/nadler-mueller-hearing-focus-on-trump-wrongdoing-evidence/968879922
1601,Nadler: Mueller testimony could begin Trump impeachment proceedings,Eleganty,nypost.com,t3_cg1ty2,politics,t5_2cneq,https://nypost.com/2019/07/21/nadler-mueller-testimony-could-begin-trump-impeachment-proceedings/
